mysql> table books;
+---------+------------+-----------+--------+----------+
| book_no | book_name  | author    | cost   | category |
+---------+------------+-----------+--------+----------+
|     101 | DBMS Guide | Navathe   | 340.00 | RDBMS    |
|     102 | O.S        | Galvin    | 440.00 | Science  |
|     103 | C          | Dennis    | 340.00 | Science  |
|     104 | SQL        | James     | 740.00 | Database |
|     105 | Harry      | J.Rowling | 720.00 | Fiction  |
+---------+------------+-----------+--------+----------+
5 rows in set (0.02 sec)

mysql> delete from books
    -> where category not in ('RDBMS','Database');
Query OK, 3 rows affected (0.07 sec)

mysql> table books;
+---------+------------+---------+--------+----------+
| book_no | book_name  | author  | cost   | category |
+---------+------------+---------+--------+----------+
|     101 | DBMS Guide | Navathe | 340.00 | RDBMS    |
|     104 | SQL        | James   | 740.00 | Database |
+---------+------------+---------+--------+----------+
2 rows in set (0.00 sec)

mysql>